{
  "$id": "https://api.cerbos.dev/cerbos/request/v1/ResourcesQueryPlanRequest.schema.json",
  "$schema": "http://json-schema.org/draft-07/schema#",
  "definitions": {
    "cerbos.engine.v1.Principal": {
      "type": "object",
      "required": [
        "id",
        "roles"
      ],
      "additionalProperties": false,
      "properties": {
        "attr": {
          "type": "object",
          "additionalProperties": {
            "$ref": "#/definitions/google.protobuf.Value"
          }
        },
        "id": {
          "type": "string",
          "minLength": 1
        },
        "policyVersion": {
          "type": "string",
          "pattern": "^[[:word:]]*$"
        },
        "roles": {
          "type": "array",
          "items": {
            "type": "string",
            "pattern": "^[[:word:]\\-\\.]+$"
          },
          "maxItems": 20,
          "minItems": 1,
          "uniqueItems": true
        },
        "scope": {
          "type": "string",
          "pattern": "^([[:alpha:]][[:word:]\\-]+(\\.[[:alpha:]][[:word:]\\-]*)*)*$"
        }
      }
    },
    "cerbos.engine.v1.ResourcesQueryPlanRequest.Resource": {
      "type": "object",
      "required": [
        "kind"
      ],
      "additionalProperties": false,
      "properties": {
        "attr": {
          "type": "object",
          "additionalProperties": {
            "$ref": "#/definitions/google.protobuf.Value"
          }
        },
        "kind": {
          "type": "string",
          "minLength": 1,
          "pattern": "^[[:alpha:]][[:word:]\\@\\.\\-/]*(\\:[[:alpha:]][[:word:]\\@\\.\\-/]*)*$"
        },
        "policyVersion": {
          "type": "string",
          "pattern": "^[[:word:]]*$"
        },
        "scope": {
          "type": "string",
          "pattern": "^([[:alpha:]][[:word:]\\-]+(\\.[[:alpha:]][[:word:]\\-]*)*)*$"
        }
      }
    },
    "cerbos.request.v1.AuxData": {
      "type": "object",
      "additionalProperties": false,
      "properties": {
        "jwt": {
          "$ref": "#/definitions/cerbos.request.v1.AuxData.JWT"
        }
      }
    },
    "cerbos.request.v1.AuxData.JWT": {
      "type": "object",
      "required": [
        "token"
      ],
      "additionalProperties": false,
      "properties": {
        "keySetId": {
          "type": "string"
        },
        "token": {
          "type": "string",
          "minLength": 1
        }
      }
    },
    "google.protobuf.Value": {
      "title": "Value",
      "description": "A dynamically-typed value."
    }
  },
  "type": "object",
  "required": [
    "principal"
  ],
  "additionalProperties": false,
  "properties": {
    "action": {
      "type": "string"
    },
    "auxData": {
      "$ref": "#/definitions/cerbos.request.v1.AuxData"
    },
    "includeMeta": {
      "type": "boolean"
    },
    "principal": {
      "$ref": "#/definitions/cerbos.engine.v1.Principal"
    },
    "requestId": {
      "type": "string"
    },
    "resource": {
      "$ref": "#/definitions/cerbos.engine.v1.ResourcesQueryPlanRequest.Resource"
    }
  }
}
