{
  "requestId": "test",
  "includeMeta": true,
  "action": "delete",
  "principal": {
    "id": "john",
    "roles": [
      "employee"
    ],
    "attr": {
      "department": "marketing",
      "managed_geographies": "GB",
      "geography": "GB",
      "team": "design",
      "ip_address": "10.20.0.5"
    }
  },
  "resource": {
    "kind": "leave_request",
    "scope": "acme.hr.uk",
    "attr": {
      "geography": "GB"
    }
  },
  "auxData": {
    "jwt": {
      "token": "eyJhbGciOiJFUzM4NCIsImtpZCI6IjE5TGZaYXRFZGc4M1lOYzVyMjNndU1KcXJuND0iLCJ0eXAiOiJKV1QifQ.eyJhdWQiOlsiY2VyYm9zLWp3dC10ZXN0cyJdLCJjdXN0b21BcnJheSI6WyJBIiwiQiIsIkMiXSwiY3VzdG9tSW50Ijo0MiwiY3VzdG9tTWFwIjp7IkEiOiJBQSIsIkIiOiJCQiIsIkMiOiJDQyJ9LCJjdXN0b21TdHJpbmciOiJmb29iYXIiLCJleHAiOjE5NDk5MzQwMzksImlzcyI6ImNlcmJvcy10ZXN0LXN1aXRlIn0.WN_tOScSpd_EI-P5EI1YlagxEgExSfBjAtcrgcF6lyWj1lGpR_GKx9goZEp2p_t5AVWXN_bjz_sMUmJdJa4cVd55Qm1miR-FKu6oNRHnSEWdMFmnArwPw-YDJWfylLFX"
    }
  }
}
